text,label
The train was moderately full today.,neutral
I would much prefer to drive than take the train.,negative
I watched a train pass through the station.,neutral
The train offered snacks for purchase.,neutral
The train had a well-maintained interior.,neutral
Relaxing on a train is my favorite way to spend a day.,positive
We experienced a breakdown during our journey.,negative
The comfortable interiors of the train made the trip enjoyable.,positive
The train was not just comfortable; it was luxurious.,positive
I appreciated the ease of travel provided by the train system.,neutral
I appreciated the free Wi-Fi available on the train.,neutral
The train had various classes of seating available.,neutral
The train service was efficient and effective.,neutral
The train's air conditioning was not functioning properly.,negative
The train's Wi-Fi connection was unreliable at best.,negative
I can’t wait to explore new cities by train!,positive
I felt a sense of safety during my journey.,neutral
Traveling by train offers a wonderful opportunity for reflection.,positive
The train lacked essential comforts that passengers require.,negative
Every train trip has a story to tell.,positive
The train cars had adequate lighting.,neutral
I felt relieved to find my train platform easily.,neutral
The beauty of traveling by train can’t be overstated.,positive
The train car was unbearably hot.,negative
The ambiance of the train made for a perfect travel experience.,positive
My commute involved taking the train.,neutral
I took in the scenery as we traveled along.,neutral
I’ve traveled by train many times.,neutral
The train traveled at a consistent speed.,neutral
I completely missed my stop on the train.,negative
The train departed on schedule.,neutral
The train’s friendly atmosphere is always welcoming.,positive
Technical issues caused a significant delay in our journey.,negative
The train was overcrowded and extremely uncomfortable.,negative
The train was equipped with everything I needed for a comfortable journey.,positive
I love planning train trips for the memories they create.,positive
The ride was relatively uneventful but pleasant.,neutral
The process of purchasing tickets was seamless.,neutral
The journey was less comfortable than I anticipated.,negative
I had a frustrating time changing trains along my route.,negative
I lost personal items during my train ride.,negative
I took the train to visit the city center.,neutral
The train made a number of stops before reaching the destination.,neutral
I often take my journal to jot down thoughts while on the train.,positive
Traveling by train helps me disconnect and recharge.,positive
I found a seat right by the window.,neutral
The food served on the train was way too expensive.,negative
Train journeys provide an unparalleled experience.,positive
The overall experience with the train was less than satisfactory.,negative
The conductor performed his duties well.,neutral
The trip to my destination involved multiple train transfers.,neutral
The ride was bumpy and made me feel sick.,negative
The peacefulness of the train ride made it all the more enjoyable.,positive
The train ride gave me the chance to reflect on my journey.,positive
The service on the train exceeded my expectations.,positive
I appreciate the environmental benefits of choosing train travel.,positive
The comfortable chairs on the train made the journey feel luxurious.,positive
I had a hard time finding the correct train platform.,negative
I absolutely love traveling by train!,positive
I noticed the cleanliness of the train car.,neutral
The train's schedule was confusing and hard to follow.,negative
The train station was quite busy during rush hour.,neutral
The journey allowed me to observe the local scenery.,neutral
The train had a comfortable waiting area.,neutral
The announcements made during the trip were clear.,neutral
I encountered rude passengers during my journey.,negative
There was a significant lack of available seating on the train.,negative
Unexpected delays made the journey exasperating.,negative
We faced delays due to signal issues along the route.,negative
I regret my decision to take the train over other travel options.,negative
Service on the train was below my expectations.,negative
The train ride took much longer than I had anticipated.,negative
There is something magical about traveling by train.,positive
Train stations often have a charm of their own.,positive
I love the nostalgia of train travel; it brings back fond memories.,positive
I always feel a sense of excitement boarding the train.,positive
The train was one of the most reliable forms of travel I've used.,neutral
I felt ignored by the staff during my trip.,negative
The ride was smooth and made for a pleasant experience.,positive
I look forward to each and every train journey I embark upon.,positive
Every moment spent on the train feels like an adventure waiting to unfold.,positive
Choosing the train for long distances has always been my best decision.,positive
I passed several towns during the journey.,neutral
The entire train trip was an utter disaster.,negative
Train travel is a delightful experience that I cherish.,positive
I arrived early to ensure a smooth boarding process.,neutral
Meeting new people on the train has always been a joy.,positive
I find the rhythm of the train soothing.,positive
The train staff seemed unhelpful and indifferent.,negative
I felt uneasy on the packed train.,negative
The train was an excellent choice for my weekend getaway.,positive
Trains are a well-established mode of transport.,neutral
The train schedule was easy to read.,neutral
Every train ride brings new opportunities for adventure.,positive
Nothing compares to a scenic train ride through the countryside.,positive
The train was unclean and poorly maintained.,negative
The train had a designated quiet zone.,neutral
Trains are such a convenient way to travel from one city to another.,positive
The train offered a good mix of comfort and speed.,neutral
I had an awful experience traveling by train.,negative
The spacious seating on the train was very comforting.,positive
I was highly disappointed with the amenities on the train.,negative
I had to stand the entire trip because there were no seats available.,negative
I cherish the moments spent traveling by train with family.,positive
I feel so connected to nature while traveling by train.,positive
I had to wait briefly for the next train.,neutral
The train station was crowded and disorganized.,negative
The train was delayed for several hours.,negative
"The train ride was relaxing, allowing me to catch up on my reading.",positive
I love the view of the changing landscapes from the train.,positive
I enjoy watching the world go by from my train seat.,positive
Traveling by train allows me to meet interesting people.,positive
I observed various types of trains while at the station.,neutral
The excitement of embarking on a train journey never fades.,positive
The views from my train window were simply breathtaking.,positive
I felt inspired during my journey on the train.,positive
Train travel has become my preferred method of exploring.,positive
The ticketing process was frustrating and inconvenient.,negative
The scenic routes offered mesmerizing landscapes.,positive
Trains often take you through stunning landscapes that other transports miss.,positive
The train's punctuality made planning my trip so much easier.,positive
"To my surprise, the train arrived ahead of schedule!",positive
I wish I had chosen an alternative means of transportation.,negative
I made use of the train’s charging ports.,neutral
I enjoyed the delightful dining options available on the train.,positive
The train ride was chaotic and loud.,negative
The noise levels on the train were unbearable at times.,negative
I felt cramped and uncomfortable in my seat for the entire trip.,negative
Traveling by train gives me a sense of freedom.,positive
The train staff were incredibly friendly and accommodating.,positive
I noticed several train enthusiasts capturing pictures.,neutral
The views during the train ride were postcard-perfect.,positive
The train was excessively slow and frustrating.,negative
The announcements on the train were frequent and informative.,neutral
